{
  "$schema": "https://json-schema.org/draft/2020-12/schema",
  "$id": "https://example.com/receipt.schema.json",
  "title": "Receipt Annotation Schema",
  "type": "object",
  "required": [
    "merchant",
    "transaction",
    "items",
    "summary",
    "ocr_metadata",
    "ocr_raw"
  ],
  "properties": {
    "merchant": {
      "type": "object",
      "required": ["name"],
      "properties": {
        "name": { "type": "string" },
        "address": { "type": "string" },
        "phone": { "type": "string" },
        "tax_id": { "type": "string" },
        "website": { "type": "string" }
      },
      "additionalProperties": false
    },

    "transaction": {
      "type": "object",
      "required": ["date", "currency", "total"],
      "properties": {
        "date": {
          "type": "string",
          "format": "date",
          "description": "Transaction date in ISO-8601 format (YYYY-MM-DD)"
        },
        "time": {
          "type": "string",
          "pattern": "^([01]\\d|2[0-3]):[0-5]\\d:[0-5]\\d$"
        },
        "currency": {
          "type": "string",
          "minLength": 3,
          "maxLength": 3,
          "description": "ISO 4217 currency code"
        },
        "payment_method": { "type": "string" },

        "subtotal": { "type": "number", "minimum": 0 },
        "tax": { "type": "number", "minimum": 0 },
        "tip": { "type": "number", "minimum": 0 },
        "total": { "type": "number", "minimum": 0 },

        "accounting_category": { "type": "string" },
        "category_confidence": {
          "type": "number",
          "minimum": 0,
          "maximum": 1
        }
      },
      "additionalProperties": false
    },

    "items": {
      "type": "array",
      "minItems": 0,
      "items": {
        "type": "object",
        "required": ["name", "quantity", "total_price"],
        "properties": {
          "name": { "type": "string" },
          "quantity": { "type": "number", "minimum": 0 },
          "unit_price": { "type": "number", "minimum": 0 },
          "total_price": { "type": "number", "minimum": 0 },

          "category": { "type": "string" },
          "accounting_category": { "type": "string" },
          "category_confidence": {
            "type": "number",
            "minimum": 0,
            "maximum": 1
          }
        },
        "additionalProperties": false
      }
    },

    "summary": {
      "type": "object",
      "properties": {
        "total_items": { "type": "integer", "minimum": 0 },
        "rounding": { "type": "number" },
        "change_due": { "type": "number", "minimum": 0 }
      },
      "additionalProperties": false
    },

    "ocr_metadata": {
      "type": "object",
      "required": ["source_image", "extraction_engine"],
      "properties": {
        "source_image": { "type": "string" },
        "extraction_engine": { "type": "string" },
        "model_version": { "type": "string" },
        "confidence": {
          "type": "number",
          "minimum": 0,
          "maximum": 1
        }
      },
      "additionalProperties": false
    },

    "ocr_raw": {
      "type": "object",
      "required": ["full_text"],
      "properties": {
        "full_text": { "type": "string" }
      },
      "additionalProperties": false
    }
  },
  "additionalProperties": false
}
