{
  "merchant": {
    "name": "Bemed (SP) SDN. BHD.",
    "address": "No.49, Jalan Dinar G U3/G, Subang Perdana, 40150 Shah Alam, Selangor D.E.",
    "phone": "03-7845 6155",
    "tax_id": "001734154430",
    "website": ""
  },
  "transaction": {
    "date": "2017-02-25",
    "time": "07:43:54",
    "currency": "MYR",
    "payment_method": "CASH",
    "subtotal": 231.0,
    "tax": 11.72,
    "tip": 0.0,
    "total": 217.0,
    "accounting_category": "General Merchandise",
    "category_confidence": 0.9
  },
  "items": [
    {
      "name": "NH Delicaderma Protective CR 50M",
      "quantity": 1,
      "unit_price": 76.0,
      "total_price": 76.0,
      "category": "Health & Beauty",
      "accounting_category": "Health Products",
      "category_confidence": 0.9
    },
    {
      "name": "11-(Beprogent CR LS) 30G",
      "quantity": 1,
      "unit_price": 10.0,
      "total_price": 10.0,
      "category": "Health & Beauty",
      "accounting_category": "Health Products",
      "category_confidence": 0.9
    },
    {
      "name": "Alpha Lipid Life Line 450MG 450G",
      "quantity": 1,
      "unit_price": 165.0,
      "total_price": 165.0,
      "category": "Health & Beauty",
      "accounting_category": "Health Products",
      "category_confidence": 0.9
    }
  ],
  "summary": {
    "total_items": 3,
    "rounding": 0.0,
    "change_due": 0.0
  },
  "ocr_metadata": {
    "source_image": "sroie_X51006332649.jpg",
    "extraction_engine": "gpt-4o-vision",
    "model_version": "2024-05-13",
    "confidence": 0.95
  },
  "ocr_raw": {
    "full_text": "BEMED (SP) SDN. BHD.\nNo.49, Jalan Dinar G U3/G,\nSubang Perdana,\n40150 Shah Alam, Selangor D.E.\n03-7845 6155\nGST Reg: 001734154430\nCASH RECEIPT\nCB#: 450786880320 25/Feb/2017 07:43:54\nCashier: be()\nQty Code&Desc Price Total\nNH DELICADERMA PROTECTIVE CR 50M\n1 348000 76.00 76 SR\n11-(BEPROGENT CR LS) 30G\n1 178032 10.00 10 ZRL\nALPHA LIPID LIFE LINE 450MG 450G\n1 134310 165.00 165 SR\nType: 3\nSubTotal: 231.00\nCash Promotion 34.00\nRounding Adj: 0.00\nTotal Inclusive GST: 217.00\nGST Summary: Amount (MYR) Tax (MYR)\nSR 205.28 11.72\nZRL 10.00 0.00\nONG GUAT CHYE\nPoints: 315\nThank you. Please come again."
  }
}