{
  "merchant": {
    "name": "UNIHAKKA INTERNATIONAL SDN BHD",
    "address": "12, Jalan Tampoi 7/4, Kawasan Perindustrian Tampoi, 81200 Johor Bahru, Johor",
    "phone": "",
    "tax_id": "867388-U",
    "website": ""
  },
  "transaction": {
    "date": "2018-05-10",
    "time": "12:32:00",
    "currency": "USD",
    "payment_method": "CASH",
    "subtotal": 9.72,
    "tax": 0.58,
    "tip": 0.0,
    "total": 10.3,
    "accounting_category": "Dining",
    "category_confidence": 0.9
  },
  "items": [
    {
      "name": "4 Vege",
      "quantity": 1,
      "unit_price": 5.5,
      "total_price": 5.5,
      "category": "Vegetarian Dish",
      "accounting_category": "Dining",
      "category_confidence": 0.9
    },
    {
      "name": "Seafood (M)",
      "quantity": 1,
      "unit_price": 4.8,
      "total_price": 4.8,
      "category": "Seafood Dish",
      "accounting_category": "Dining",
      "category_confidence": 0.9
    }
  ],
  "summary": {
    "total_items": 2,
    "rounding": 0.0,
    "change_due": 0.0
  },
  "ocr_metadata": {
    "source_image": "sroie_X51006913030.jpg",
    "extraction_engine": "gpt-4o-vision",
    "model_version": "2024-05-13",
    "confidence": 0.95
  },
  "ocr_raw": {
    "full_text": "UNIHAKKA INTERNATIONAL SDN BHD\n10 May 2018 12:32\n(867388-U)\n12, Jalan Tampoi 7/4,Kawasan Perindustrian\nTampoi,81200 Johor Bahru,Johor\nTAX INVOICE\nInvoice # : OR18051002160062\nItem Qty Total\nSR 100100000060- 4 Vege\n$5.50 1 $5.50\nSR 100100000009- Seafood (M)\n$4.80 1 $4.80\nTotal Amount: $10.30\nGST @6%: $0.58\nNett Total: $10.30\nPayment Mode Amount\nCASH $10.30\nChange $0.00\nGST Summary Amount($) Tax($)\nSR = GST @6% 9.72 0.58\nGST REG #000656195584\nBAR WANG RICE@PERMAS JAYA\n(Price Inclusive Of GST)\nThank You & Come Again!\nLike and Follow Us on Facebook!\nFacebook.com/BarWangRice"
  }
}