{
  "merchant": {
    "name": "RESTORAN WAN SHENG",
    "address": "No.2, Jalan Temenggung 19/9, Seksyen 9, Bandar Mahkota Cheras, 43200 Cheras, Selangor",
    "phone": "",
    "tax_id": "001335787520",
    "website": ""
  },
  "transaction": {
    "date": "2018-06-11",
    "time": "17:11:42",
    "currency": "ZRL",
    "payment_method": "CASH",
    "subtotal": 7.8,
    "tax": 0.0,
    "tip": 0.0,
    "total": 7.8,
    "accounting_category": "Food and Beverage",
    "category_confidence": 0.95
  },
  "items": [
    {
      "name": "Teh (B)",
      "quantity": 2,
      "unit_price": 2.2,
      "total_price": 4.4,
      "category": "Beverage",
      "accounting_category": "Food and Beverage",
      "category_confidence": 0.95
    },
    {
      "name": "Milo (B)",
      "quantity": 1,
      "unit_price": 2.8,
      "total_price": 2.8,
      "category": "Beverage",
      "accounting_category": "Food and Beverage",
      "category_confidence": 0.95
    },
    {
      "name": "Take Away",
      "quantity": 3,
      "unit_price": 0.2,
      "total_price": 0.6,
      "category": "Service",
      "accounting_category": "Food and Beverage",
      "category_confidence": 0.95
    }
  ],
  "summary": {
    "total_items": 6,
    "rounding": 0.0,
    "change_due": 0.0
  },
  "ocr_metadata": {
    "source_image": "sroie_X51008099087.jpg",
    "extraction_engine": "gpt-4o-vision",
    "model_version": "2024-05-13",
    "confidence": 0.95
  },
  "ocr_raw": {
    "full_text": "RESTORAN WAN SHENG\n002043319-W\nNo.2, Jalan Temenggung 19/9,\nSeksyen 9, Bandar Mahkota Cheras,\n43200 Cheras, Selangor\nGST REG NO: 001335787520\n\nTax Invoice\n\nINV No.: 1187070 Cashier: Thandar\nDate : 11-06-2018 17:11:42\n------------------------------------\nDescription Qty U.price Total TAX\n------------------------------------\nTeh (B) 2 x 2.20 4.40 ZRL\nMilo (B) 1 x 2.80 2.80 ZRL\nTake Away 3 x 0.20 0.60 ZRL\n\nTotal QTY: 6\nTotal (Excluding GST): 7.80\nTotal (Inclusive of GST):\n\nTOTAL: 7.80\n\nCASH : 7.80\n------------------------------------\nGST Summary Amount (RM) Tax (RM)\nZRL (@ 0%) 7.80 0.00\n"
  }
}