{
  "merchant": {
    "name": "Tous Les Jours",
    "address": "",
    "phone": "",
    "tax_id": "",
    "website": ""
  },
  "transaction": {
    "date": "2023-10-06",
    "time": "",
    "currency": "KRW",
    "payment_method": "cash",
    "subtotal": 15500.0,
    "tax": 0.0,
    "tip": 0.0,
    "total": 15500.0,
    "accounting_category": "Food & Beverage",
    "category_confidence": 0.95
  },
  "items": [
    {
      "name": "Choco Coronet",
      "quantity": 1,
      "unit_price": 15500.0,
      "total_price": 15500.0,
      "category": "Bakery",
      "accounting_category": "Food & Beverage",
      "category_confidence": 0.95
    }
  ],
  "summary": {
    "total_items": 1,
    "rounding": 0.0,
    "change_due": 34500.0
  },
  "ocr_metadata": {
    "source_image": "cord_000403.jpg",
    "extraction_engine": "gpt-4o-vision",
    "model_version": "2024-05-13",
    "confidence": 0.95
  },
  "ocr_raw": {
    "full_text": "TOUS LES JOURS\n1 CHOCO CORONET      15,500\nTOTAL               15,500\nCASH                50,000\nCHANGE              34,500"
  }
}