{
  "merchant": {
    "name": "BP Domingos Segueira",
    "address": "Rua Domingos Sequeira, 20 Tel: 213905000, 1350 122 Lisboa",
    "phone": "213905000",
    "tax_id": "508833203",
    "website": ""
  },
  "transaction": {
    "date": "2018-07-23",
    "time": "17:24:16",
    "currency": "EUR",
    "payment_method": "VISA Electron",
    "subtotal": 65.04,
    "tax": 0.96,
    "tip": 0.0,
    "total": 66.0,
    "accounting_category": "Fuel",
    "category_confidence": 0.9
  },
  "items": [
    {
      "name": "Gasoline",
      "quantity": 1,
      "unit_price": 1.446,
      "total_price": 65.04,
      "category": "Fuel",
      "accounting_category": "Fuel",
      "category_confidence": 0.9
    }
  ],
  "summary": {
    "total_items": 1,
    "rounding": 0.0,
    "change_due": 0.0
  },
  "ocr_metadata": {
    "source_image": "zenodo_20210508_204657.jpg",
    "extraction_engine": "gpt-4o-vision",
    "model_version": "2024-05-13",
    "confidence": 0.95
  },
  "ocr_raw": {
    "full_text": "BP Domingos Sequeira\nPETRODIESEL COMBUSTIVEIS, LDA.\nRua Domingos Sequeira, 20 Tel: 213905000\n1350 122 Lisboa\nMatricula / NIPC: 508 833 203\n\nPst : Ref 2427 Op: Jose Luis\nData do recibo: 2018/07/23 17:24:16\n\nGasoleo Simpla: 5,240 L x 1,446 EUR / L\n\nTotal 60.00 EUR\n\nMultibanco 60.00 EUR\nIVAM   1.10 0.96 EUR\nIVA A 23 0014 96 EUR 65.00 EUR 60.00 EUR\n\nFatura Recibo FR 270551001/024589\n\nNome: FLEXINOME, MEDIÇÃO IMOBILIARIA, LDA.\nMorada: R. SARAIVA DE CARVALHO, N. 9 244, 3.9 DTO\n1350-302 LISBOA\nMatricula 69 4E 53\n\nNumero Cartao: ************7420\nPontos Emitidos: 5\nPontos por Promo: 0\nPontos Actuais: 1541\nSaldo disponível Poupa Mais: 0 EUR\nExpira: 31-01-2018 0 EUR\n\nPETRODIESEL 001 QUINTA DO CONDE QUINTA DO CONDE\nTerminal Pagamento Automático: 00857932\n2018-07-23 17:24:46 Per003: 17029 Msg140\n\nNOVID BANCO\nSOPHIA PRIMO PEREIRA\nCARTAO: *****7420/28\nA0000000032010 VISA ELECTRON\nCOMPRA 60,00 EUR VISA DE N\nID 06857932170297109 AUT:870400\n\nNetpay A Rede com Certificado 1509001\nPROCESSADO POR SIBS"
  }
}